project	key	title	abstract	doi	decision	mode	exclusion_criteria	reviewer_count
	MED1183_F2	HeartCare+: A Smart Heart Care Mobile Application for Framingham-Based Early Risk Prediction of Hard Coronary Heart Diseases in Middle East,	Background. Healthcare is a challenging, yet so demanding sector that developing countries are paying more attention to recently. Statistics show that rural areas are expected to develop a high rate of heart diseases, which is a leading cause of sudden mortality, in the future. Thus, providing solutions that can assist rural people in detecting the cardiac risks early will be vital for uncovering and even preventing the long-Term complications of cardiac diseases. Methodology. Mobile technology can be effectively utilized to limit the cardiac diseases’ prevalence in rural Middle East. This paper proposes a smart mobile solution for early risk detection of hard coronary heart diseases that uses the Framingham scoring model. Results. Smart HeartCare+ mobile app estimates accurately coronary heart diseases’ risk over 10 years based on clinical and nonclinical data and classifies the patient risk to low, moderate, or high. HeartCare+ also directs the patients to further treatment recommendations. Conclusion. This work attempts to investigate the effectiveness of the mobile technology in the early risk detection of coronary heart diseases. HeartCare+ app intensifies the communication channel between the lab workers and patients residing in rural areas and cardiologists and specialist residing in urban places.,” vol. 2017, 2017, doi: 10.1155/2017/9369532.		Ex	new_screen		
	MED1322_B1	Design and Testing of a Smartphone Application for Real-Time Self-Tracking Diabetes Self-Management Behaviors,	Background Type 1 diabetes (T1D) care requires multiple daily self-management behaviors (SMBs). Preliminary studies on SMBs rely mainly on self-reported survey and interview data. There is little information on adult T1D SMBs, along with corresponding compensation techniques (CTs), gathered in real-time. Objective The article aims to use a patient-centered approach to design iDECIDE, a smartphone application that gathers daily diabetes SMBs and CTs related to meal and alcohol intake and exercise in real-time, and contrast patients’ actual behaviors against those self-reported with the app. Methods Two usability studies were used to improve iDECIDE’s functionality. These were followed by a 30-day pilot test of the redesigned app. A survey designed to capture diabetes SMBs and CTs was administered prior to the 30-day pilot test. Survey results were compared against iDECIDE logs. Results Usability studies revealed that participants desired advanced features for self-tracking meals and alcohol intake. Thirteen participants recorded over 1,200 CTs for carbohydrates during the 30-day study. Participants also recorded 76 alcohol and 166 exercise CTs. Comparisons of survey responses and iDECIDE logs showed mean% (standard deviation) concordance of 77% (25) for SMBs related to meals, where concordance of 100% indicates a perfect match. There was low concordance of 35% (35) and 46% (41) for alcohol and exercise events, respectively. Conclusion The high variability found in SMBs and CTs highlights the need for real-time diabetes self-tracking mechanisms to better understand SMBs and CTs. Future work will use the developed app to collect SMBs and CTs and identify patient-specific diabetes adherence barriers that could be addressed with individualized education interventions.,” vol. 9, no. 2, pp. 440–449, 2018, doi: 10.1055/s-0038-1660438.		Ex	new_screen		
	MED1341_B2	Usability testing of an online self-management program for Adolescents with Juvenile Idiopathic Arthritis,	Background: A new bilingual (English and French) Internet-basedself- management program, Teens Taking Charge: Managing Arthritis Online, for adolescents with arthritis and their parents was developed following a needs assessment.Objectives: This study explored the usability (user performance and satisfaction) of the self-management program for youth with juvenile idiopathic arthritis (JIA) and their parents to refine the health portal prototype.Methods: A qualitative study design with semi-structured, audio taped interviews and observation by a trained observer was undertaken with two iterative cyclesto determine the usability (ease of use, efficiency, errors, and user satisfaction) of the user interface and content areas of the intervention. A purposive sample of English-speaking (n = 11; mean age = 15.4, standard deviation [SD] 1.7) and French-speaking (n = 8; mean age = 16.0, SD 1.2) adolescents with JIA and one of their respectiveparents/caregivers were recruited from 2 Canadian tertiary care centers. Descriptive statistics and simple content analyses were used toorganize data into categories that reflected the emerging usability themes.Results: All of the participants had access to a computer/Internet at home; however, adolescents were more comfortable using the computer/Internet than their parents. Adolescents and parents provided similar as well as differing suggestions on how the website user interface could be improved in terms of its usability (navigation; presentation and control usage errors; format and layout; as well as areas for further content development). There were no major differences in usability issues between Englishand French-speaking participants. Minor changes to the website user interface were made and tested in a second cycle of participants.No further usability problems were identified in the second iterative cycle of testing. Teens and parents responded positively to the appearance and theme of the website (ie, promoting self-management) and felt that it was easy to navigate, use, and understand.Participants felt that the content was appropriate and geared to meet the unique needs of adolescents with JIA and their parents as well as English- and French-speaking families. Many participants responded that the interactive features (discussion board,stories of hope, and video clips of youth with JIA) made them feel supported and ‘not alone’ in their illness.Conclusions: We describe the usability testing of a self-management hea…,” vol. 12, no. 3, 2010, doi: 10.2196/jmir.1349.		In	new_screen		
	MED1341_F1	A mobile phone intervention to improve obesity-related health behaviors of adolescents across Europe: Iterative co-design and feasibility study,	Background: Promotion of physical activity, healthy eating, adequate sleep, and reduced sedentary behavior in adolescents is a major priority globally given the current increase in population health challenges of noncommunicable diseases and risk factors such as obesity. Adolescents are highly engaged with mobile technology, but the challenge is to engage them with mobile health (mHealth) technology. Recent innovations in mobile technology provide opportunities to promote a healthy lifestyle in adolescents. An increasingly utilized approach to facilitate increased engagement with mHealth technology is to involve potential users in the creation of the technology. Objective: This study aimed to describe the process of and findings from co-designing and prototyping components of the PEGASO Fit for Future (F4F) mHealth intervention for adolescents from different cultural backgrounds. Methods: A total of 74 adolescents aged 13 to 16 years from Spain, Italy, and the United Kingdom participated in the co-design of the PEGASO F4F technology. In 3 iterative cycles over 12 months, participants were involved in the co-design, refinement, and feasibility testing of a system consisting of diverse mobile apps with a variety of functions and facilities to encourage healthy weight-promoting behaviors. In the first iteration, participants attended a single workshop session and were presented with mock-ups or early-version prototypes of different apps for user requirements assessment and review. During the second iteration, prototypes of all apps were tested by participants for 1 week at home or school. In the third iteration, further developed prototypes were tested for 2 weeks. Participants’ user experience feedback and development ideas were collected through focus groups and completion of questionnaires. Results: For the PEGASO F4F technology to be motivating and engaging, participants suggested that it should (1) allow personalization of the interface, (2) have age-appropriate and easy-to-understand language (of icons, labels, instructions, and notifications), (3) provide easily accessible tutorials on how to use the app or navigate through a game, (4) present a clear purpose and end goal, (5) have an appealing and self-explanatory reward system, (6) offer variation in gamified activities within apps and the serious game, and (7) allow to seek peer support and connect with peers for competitive activities within the technology. Conclusions: Incorporating adolescents…,” vol. 8, no. 3, 2020, doi: 10.2196/14118.		Ex	new_screen		
	MED1341_F2	Development and validation of a smartphone educational game regarding healthy lifestyle habits for adolescents,	Objective: to elaborate and validate the content and appearance of an educational game regarding healthy lifestyle habits for adolescents Method: methodological study carried, in 2016 out in Picos (Brazil). In order to develop the initial version of the game, a survey gathered scientific information and the content. In the end, the game was divided into: home screen and the living room, kitchen and the square scene, where the sports scene was inserted. To validate the instrument, 15 experts were selected, who evaluated the content, didactics and appearance of the game. Ten adolescents evaluated the appearance and usability. In addition, one questionnaire was used for the specialists and another for the adolescents. The Content Validation Index was used to validate the game, which considered the instrument and the items as validated when an index = 0.78 was obtained. Results: the room scene had access to the kitchen and the square. The sport scene was designed for physical activity and the purchase of food, which would be consumed in the kitchen scene. The experts gave the game a Content Validation Index of 0.88 for the item ‘objectives’, 0.87 for ‘structure and presentation’ and 0.99 for ‘relevance’, reaching a overall Content Validation Index of 0.89. For adolescents, the item ‘appearance’ reached the index 0.97 and for the other items, 1.0 and overal index of 0.99. Conclusion: the game was validated in terms of content and appearance and could be validated clinically with adolescents as an incentive to adopt protective behaviors for their health.,” vol. 28, 2019, doi: 10.1590/1980-265X-TCE-2018-0252.		Ex	new_screen		
	MED425_B10	Using persuasive technology to increase physical activity in people with chronic obstructive pulmonary disease by encouraging regular walking: A mixed-methods study exploring opinions and preferences,	Background: People with chronic obstructive pulmonary disease (PwCOPD) often experience breathlessness and fatigue, making physical activity challenging. Although many persuasive technologies (such as mobile phone apps) have been designed to support physical activity among members of the general population, current technologies aimed at PwCOPD are underdeveloped and only use a limited range of persuasive technology design principles. Objective: The aim of this study was to explore how acceptable different persuasive technology design principles were considered to be in supporting and encouraging physical activity among PwCOPD. Methods: Three prototypes for mobile apps using different persuasive technology design principles as defined by the persuasive systems design (PSD) model-namely, dialogue support, primary task support, and social support-were developed. Opinions of these prototypes were explored through 28 interviews with PwCOPD, carers, and the health care professionals (HCPs) involved in their care and questionnaires completed by 87 PwCOPD. Participants also ranked how likely individual techniques (eg, competition) would be to convince them to use a technology designed to support physical activity. Data were analyzed using framework analysis, Friedman tests, and Wilcoxon signed rank tests and a convergent mixed methods design was used to integrate findings. Results: The prototypes for mobile apps were received positively by participants. The prototype that used a dialogue support approach was identified as the most likely to be used or recommended by those interviewed, and was perceived as more persuasive than both of the other prototypes (Z=-3.06, P=.002; Z=-5.50, P<.001) by those who completed the questionnaire. PwCOPD identified dialogue support and primary task support techniques as more likely to convince them to use a technology than social support techniques (Z=-5.00, P<.001; Z=-4.92, P<.001, respectively). Opinions of social support techniques such as competition and collaboration were divided. Conclusions: Dialogue support and primary task support approaches are considered to be both acceptable and likely to be persuasive by PwCOPD, carers, and HCPs. In the future, these approaches should be considered when designing apps to encourage physical activity by PwCOPD.,” vol. 19, no. 4, 2017, doi: 10.2196/jmir.6616.		Ex	new_screen		
	MED425_B11	Move2Play: An innovative approach to encouraging people to be more physically active,	Throughout the last decade, there has been an alarming de- crease in daily physical activity among both children and adults. Medical experts agree that physical activity is crit- ical to maintaining fitness, reducing weight and improving health. Yet so many people have dificulty increasing and maintaining physical activity in everyday life. We have created a solution calledMove2Play, which encourages a health- ier lifestyle and motivates to participate in regular physical activity. We have integrated four essential parts that form the basis for long-term progress and sustainability - Activity Recommendation, Tracking, Evaluation and Motivation. In order to recognize and assess physical activity, we have developed a system for mobile phones that collects data from various sensors, such as accelerometer, GPS and GSM. We provide personalization, i.e. we have proposed and realized activity recommendation for an individual user to ensure that the users engage in regular exercise, as opposed to oc- casional outbursts of activity, which are unhealthy and even harmful. We discuss our proposed mechanisms of activity recommendation and the concept of motivation, which rep- resent a key element for any system that fights the sedentary lifestyle of the modern generation. Copyright © 2012 ACM.,” in IHI’12 - Proceedings of the 2nd ACM SIGHIT International Health Informatics Symposium, 2012, pp. 61–70. doi: 10.1145/2110363.2110374.		In	new_screen		
	MED425_B2	Bounce: Designing a physical activity intervention for breast cancer survivors,	The pervasive use of personal mobile devices provides an advantage for the delivery of a behavioral intervention anywhere and anytime. However, behavioral outcomes are dependent on adoption and sustained use of mobile-based interventions. Design approaches for engagement and feasibility of use in everyday life have been studied among the general population, especially to promote physical activity. In this paper, we discuss a design process that addresses additional barriers to adoption when the target population has symptoms, limitations, or needs resulting from a specific health condition.We designed a smartphone-based physical activity intervention for breast cancer survivors by combining behavior change theory with empirical evidence. In a preliminary evaluation, participants found the application engaging and useful, and continued to use the application briefly after the evaluation ended. We illustrate how our design process was used, and could be applied to other specific health conditions.,” in ACM International Conference Proceeding Series, 2018, pp. 25–34. doi: 10.1145/3240925.3240927.		In	new_screen		
	MED425_B3	PhytoCloud: A Gamified Mobile Web Application to Modulate Diet and Physical Activity of Women with Breast Cancer,	Breast cancer incidence and mortality rates vary geographically reflecting factors including regional and cultural differences in diet and lifestyle. There are numerous successful commercial mobile apps to help people control their diet and manage weight. However, such products are not suitable for people with special medical conditions that may require targeted dietary as well as motivational support. The paper presents a user centered approach of developing a Mobile Web App that focuses on breast cancer patients looking at their specific dietary, physical and mental requirements depending on the stage of their medical treatment. The paper explores the effect of incorporating gamification and social media as motivational drive to engage and motivate people to achieve their goals of adopting healthier eating habits while increasing physical activity in order ensure lasting lifestyle behavioural change. The design of PhytoCloud is being described, a gamified Mobile Web App that enables users to record their dietary habits and physical activity and motivate their consumption of food with oestrogen-like properties (phytoestrogens) which are linked to the prevention of reappearance of breast cancer. The paper concludes with a discussion of future directions and adaptations to the current design to suite a Mobile Native Application design.		In	new_screen		
	MED425_B4	MyHealthAvatar lifestyle management support for cancer patients,	MyHealthAvatar (MHA) is built on the latest information and communications technology with the aim of collecting lifestyle and health data to promote citizen’s wellbeing. According to the collected data, MHA offers visual analytics of lifestyle data, contributes to individualised disease prediction and prevention, and supports healthy lifestyles and independent living. The iManageCancer project aims to empower patients and strengthen self-management in cancer diseases. Therefore, MHA has contributed to the iManageCancer scenario and provides functionality to the iManageCancer platform in terms of its support of lifestyle management of cancer patients by providing them with services to help their cancer management. This paper presents two different MHA-based Android applications for breast and prostate cancer patients. The components in these apps facilitate health and lifestyle data presentation and analysis, including weight control, activity, mood and sleep data collection, promotion of physical exercise after surgery, questionnaires and helpful information. These components can be used cooperatively to achieve flexible visual analysis of spatiotemporal lifestyle and health data and can also help patients discover information about their disease and its management.,” vol. 12, 2018, doi: 10.3332/ecancer.2018.849.		In	new_screen		
	MED425_B5	Bounce: An intervention to increase physical activity in breast cancer survivors,	Behavior change theories are often applied to the design of technologies for improving health and wellness. However, researchers commonly apply these theories too narrowly or too broadly, resulting in a design process that does not account for the complexities of behavior change. To address this limitation in prior research, we developed a methodological framework that blends abstract theory with contextual relevance. Based on this framework, we developed a set of design guidelines for Bounce - a smartphone application aiming to increase the physical activity of breast cancer survivors.,” in Conference on Human Factors in Computing Systems - Proceedings, 2016, vol. 07-12-May-2016, pp. 98–103. doi: 10.1145/2851581.2890383.		Ex	new_screen		
	MED425_B6	The development of a mobile monitoring and feedback tool to stimulate physical activity of people with a chronic disease in primary care: A user-centered design,	Background: Physical activity is an important aspect in the treatment of patients with chronic obstructive pulmonary disease or type-2 diabetes. A monitoring and feedback tool combined with guidance by a primary care provider might be a successful method to enhance the level of physical activity in these patients. As a prerequisite for useful technology, it is important to involve the end-users in the design process from an early stage. Objective: The aim of this study was to investigate the user requirements for a tool to stimulate physical activity, embedded in primary care practice. The leading principle of this tool is to change behavior by self-monitoring, goal-setting, and feedback. Methods: The research team collected qualitative data among 15 patients, 16 care professionals, and several experts. A prototype was developed in three stages. In stage 1, the literature was searched to identify end-users and context. In stage 2, the literature, experts and patient representatives were consulted to set up a use case with the general idea of the innovation. In stage 3, individual interviews and focus groups were held to identify the end-user requirements. Based on these requirements a prototype was built by the engineering team. Results: The development process has led to a tool that generally meets the requirements of the end-users. A tri-axial activity sensor, worn on the hip, is connected by Bluetooth to a smartphone. In an app, quantitative feedback is given about the amount of activity and goals reached by means of graphical visualization, and an image shows a sun when the goal is reached. Overviews about activity per half an hour, per day, week, and month are provided. In the menu of the app and on a secured website, patients can enter information in individual sessions or read feedback messages generated by the system. The practice nurse can see the results of all patients on a secure webpage and can then discuss the results and set personalized goals in consultation with the patient. Conclusions: This study demonstrates that a user-centered approach brings in valuable details (such as the requirements for feedback in activity minutes per day) to improve the fit between the user, technology, and the organization of care, which is important for the usability and acceptability of the tool. The tool embedded in primary care will be evaluated in a randomized controlled trial.,” vol. 1, no. 2, 2013, doi: 10.2196/mhealth.2526.		Ex	new_screen		
	MED425_B7	Usability testing of a monitoring and feedback tool to stimulate physical activity,	Introduction: A monitoring and feedback tool to stimulate physical activity, consisting of an activity sensor, smartphone application (app), and website for patients and their practice nurses, has been developed: the ‘It’s LiFe!’ tool. In this study the usability of the tool was evaluated by technology experts and end users (people with chronic obstructive pulmonary disease or type 2 diabetes, with ages from 40-70 years), to improve the user interfaces and content of the tool. Patients and methods: The study had four phases: 1) a heuristic evaluation with six technology experts; 2) a usability test in a laboratory by five patients; 3) a pilot in real life wherein 20 patients used the tool for 3 months; and 4) a final lab test by five patients. In both lab tests (phases 2 and 4) qualitative data were collected through a thinking-aloud procedure and video recordings, and quantitative data through questions about task complexity, text comprehensiveness, and readability. In addition, the post-study system usability questionnaire (PSSUQ) was completed for the app and the website. In the pilot test (phase 3), all patients were interviewed three times and the Software Usability Measurement Inventory (SUMI) was completed. Results: After each phase, improvements were made, mainly to the layout and text. The main improvement was a refresh button for active data synchronization between activity sensor, app, and server, implemented after connectivity problems in the pilot test. The mean score on the PSSUQ for the website improved from 5.6 (standard deviation [SD] 1.3) to 6.5 (SD 0.5), and for the app from 5.4 (SD 1.5) to 6.2 (SD 1.1). Satisfaction in the pilot was not very high according to the SUMI. Discussion: The use of laboratory versus real-life tests and expert-based versus user-based tests revealed a wide range of usability issues. The usability of the It’s LiFe! tool improved considerably during the study. © 2014 van der Weegen et al. This work is published by Dove Medical Press Limited.,” vol. 8, pp. 311–322, 2014, doi: 10.2147/PPA.S57961.		Ex	new_screen		
